{
  "protocol_version": "0.1.0",
  "message_id": "msg_01HZY7Y7B6Q7W4V9R8X2K3M4N5",
  "type": "event.created",
  "created_at": "2026-05-12T12:00:00Z",
  "event": {
    "event_name": "comment.created",
    "data": {
      "document_id": "doc_789",
      "document_title": "Design Draft",
      "comment_id": "cmt_123",
      "comment_text": "Can we revisit the permission model?"
    }
  }
}
